{
  "schemaVersion": 1,
  "availableTargets": [
    "claude",
    "codex",
    "openclaw"
  ],
  "supportedTargets": [
    "claude",
    "codex",
    "openclaw"
  ],
  "defaultTargets": [
    "claude",
    "codex",
    "openclaw"
  ],
  "canonicalRoots": {
    "agents": "canonical/agents",
    "skills": "canonical/skills/meta-theory",
    "runtimeAssets": "canonical/runtime-assets",
    "contracts": "contracts"
  },
  "generatedTargets": {
    "claude": [
      ".claude/agents",
      ".claude/skills",
      ".claude/hooks",
      ".claude/settings.json",
      ".mcp.json",
      ".claude/capability-index"
    ],
    "codex": [
      ".codex/agents",
      ".codex/skills",
      ".agents/skills",
      "codex/config.toml.example"
    ],
    "openclaw": [
      "openclaw/workspaces",
      "openclaw/skills",
      "openclaw/openclaw.template.json",
      "shared-skills"
    ]
  }
}
